row_id,layman_description,medical_specialty,sample_name,keywords,original_description
1475,"My joints are really stiff and ache a lot, especially in the morning. I feel tired and have a hard time gripping things.",Rheumatology,Rheumatoid Arthritis,"rheumatology, ra, rheumatoid arthritis, joint inflammation, swollen joints, arthritis, joints, inflammation, corticosteroids, rheumatoid,",A sample note on Rheumatoid Arthritis
1478,"I feel aching and pain in my joints, especially in my hands. Both of my hands are swollen and it’s getting worse.",Rheumatology,Rheumatoid Arthritis - H&P,,Patient presents for treatment of suspected rheumatoid arthritis.
1480,I don't have any joint pain right now. My wrists are a bit swollen.,Rheumatology,Rheumatoid Arthritis - Consult,"rheumatology, prednisone, joint pains, rheumatoid arthritis, arthritis, dmard, rheumatologist, rheumatoid, pains,","A 71-year-old female who I am seeing for the first time.  She has a history of rheumatoid arthritis for the last 6 years.  She is not on DMARD, but as she recently had a surgery followed by a probable infection."
1481,"My left hand feels uncomfortable, especially around the back of my second, third, and fourth fingers. I have a dry cough and feel like I have a fever.",Rheumatology,Hand Discomfort - Followup,,"Followup of left hand discomfort and systemic lupus erythematosus.  Carpal tunnel involving the left wrist with sensory change, but no evidence of motor change."
1482,"My cheeks have a rash that's getting lighter now. I feel fine otherwise, no pain or discomfort.",Rheumatology,Discoid Lupus,"rheumatology, lupus, systemic lupus, acanthosis nigricans, discoid lupus, extremities, rash, erythema, discoid,",A 12-year-old with discoid lupus on the control with optimal regimen.
1483,I'm feeling very weak and have almost no strength in my legs. I also have a rash on my left side and a cough.,Rheumatology,Consult - Weankness & Polymyositis,,Consultation - an 87-year-old white female with weakness and a history of polymyositis.
1484,"I feel pain in my knees and I'm really tired all the time. My legs, neck, and hands feel stiff.",Rheumatology,Oligoarticular Arthritis - 2,"rheumatology, arthralgias, deficiency, vitamin d, collagen vascular diseases, seizure disorder, vascular diseases, joint pains, oligoarticular arthritis, arthritis, oligoarticular,",A lady with symptoms consistent with possible oligoarticular arthritis of her knees.
1487,"My right knee hurts almost every day, but I only take medicine when the pain gets bad. There's some mild swelling and tenderness in my knee too.",Rheumatology,Oligoarticular Arthritis - 1,"rheumatology, rheumatology clinic, lower extremities, oligoarticular arthritis, arthritis, oligoarticular, knee, swelling,",A 17-year-old male with oligoarticular arthritis of his right knee.
